{"schema_version":2,"id":"dashboard-panel-inspection-playbook","extends":"dashboard.json","variables":{"title":"Dashboard panel analysis","field":"panel.metric","window":"${param.window}","field_label":"metric","value":"failed transactions","panel":"Failed payment transactions"},"goal_overrides":{"isolate":{"title":"Pick the panel that answers the question","narration":"The two panels disagree. Click the series in the panel whose calculation answers the incident question, so every panel filters to it.","demonstration":{"narration":"I'll click the series in the panel whose calculation answers the incident question, then check how both panels count.","reasoning":"Two panels can disagree because they count different things. Selecting the one that matches the question, then inspecting both, separates a real contradiction from different definitions.","evidence":"Every panel now filters to ${var.value}. That series counts transactions only; the other panel counts every event, spans included."}},"inspect":{"narration":"Inspect how each panel calculates its number and confirm which one answers the incident question.","demonstration":{"narration":"I'll inspect each panel's calculation to see exactly which events it counts, and over what scope.","reasoning":"A chart is an aggregate and can be misread if its formula, buckets or filters are misunderstood. The inspector shows the request behind the number.","evidence":"One panel counts all events, spans included; the decisive panel counts failed transactions only. ${truth.conclusion}"},"reference_action":{"command":"inspect_panel","target":"kibana.panel_menu","arguments":{"panel":"${var.panel}"}},"hints":["Two panels can disagree because they count different things.","Hover a panel and use Inspect, then its Requests view, to see the query behind the number.","Inspect ${var.panel}'s request; Show me can open it."]}}}
