{"schema_version":2,"id":"hot-instance-imbalance-playbook","extends":"infrastructure.json","variables":{"title":"Instance-imbalance analysis","inventory":"hosts","metric":"CPU usage","entity":"orders-04"},"goal_overrides":{"inspect":{"demonstration":{"narration":"I'll open the hot host's detail and logs, then compare the same period with peers to check that it's an outlier.","reasoning":"A resource spike alone does not prove customer impact or causation. Matching its entity and timing to another observable signal tests the relationship.","evidence":"The supporting record should align with the outlier’s entity and time.\n\nThat independent correlation turns the metric pattern into evidence for the conclusion: ${truth.conclusion}"}}}}
