{"schema_version":2,"id":"esql-cross-service-summary-playbook","extends":"esql.json","variables":{"title":"Cross-service summary","field":"service.name","query":"FROM lab-${run_id} | STATS volume = COUNT(*), failures = COUNT(*) WHERE event.outcome == \"failure\", p95 = PERCENTILE(event.duration, 95) BY service.name | SORT failures DESC"},"goal_overrides":{"isolate":{"demonstration":{"narration":"I'll group by service.name and calculate volume, failures, and p95 latency to see which service stands out on reliability and speed.","reasoning":"Each pipeline stage has a distinct job. Filtering before STATS keeps unrelated rows out of the measures; grouping and sorting let us compare the resulting values.","evidence":"The result table now contains one row per ${var.field} group and the calculated values. Compare the rows to identify which group stands out."}},"inspect":{"demonstration":{"narration":"I'll read the leading service's volume, failures, and p95 together to check what its rank actually means.","reasoning":"A top-ranked name without its numbers is not enough evidence, and numbers without the group key have no owner.\n\nReading both parts verifies that the query result supports the intended comparison rather than merely returning rows.","evidence":"The decisive row should pair ${truth.finding} with ${truth.scope}.\n\nThose concrete values corroborate the aggregation and justify the conclusion: ${truth.conclusion}"}}}}
