{
  "schema_version":2,"id":"infrastructure-template","version":1,"starting_view":{"app":"metrics"},
  "demonstration_summary": {"title":"${var.title} complete","checks":[{"title":"Comparable inventory","detail":"Selected the ${var.inventory} inventory for a like-for-like view."},{"title":"Metric outlier","detail":"Used ${var.metric} to surface ${truth.finding} against peers."},{"title":"Time-aligned correlation","detail":"Correlated it with logs to confirm the impact."}],"answer":{"finding":"${truth.finding}","scope":"${truth.scope}","conclusion":"${truth.conclusion}","evidence_refs":"signal,corroboration","evidence":"The ${var.metric} pattern and correlated event connect ${truth.finding} to ${truth.scope}."}},
  "goals":[
    {"id":"scope","title":"Select the relevant inventory","concept":"Inventory type and time context determine which infrastructure entities are comparable.","narration":"Select the relevant inventory and scenario interval.","reasoning":"The correct entity level prevents host, container, and service signals from being conflated.","evidence":"The inventory shows the scenario entities.","demonstration":{"narration":"Select the ${var.inventory} inventory for “${scenario.title}”.\n\nThis chooses the entity level we will compare before looking for an unusual resource pattern.","reasoning":"Hosts, pods, containers, and services describe different ownership levels. Comparing like entities gives us a meaningful baseline.","evidence":"The inventory now lists comparable entities at the ${var.inventory} level. We can look for an outlier in the next view."},"requires":[],"accepts":[{"action":["inventory_type_selected","time_range_changed","infrastructure_entities_filtered"],"validators":[{"kind":"result_assertion","assertion":"signal"}]}],"reference_action":{"command":"select_inventory_type","target":"kibana.inventory_type","arguments":{"type":"${var.inventory}"}},"hints":["Choose the entity level that owns the reported resource.","Use the Infrastructure inventory selector.","Select ${var.inventory}; Show me can demonstrate it."]},
    {"id":"isolate","title":"Isolate the decisive entity and metric","concept":"Grouping and peer comparison reveal outliers hidden by aggregate health.","narration":"Filter or group entities and select the relevant metric.","reasoning":"The abnormal entity must be compared with healthy peers or an earlier period.","evidence":"The selected metric contains the scenario signal.","demonstration":{"narration":"Select the ${var.metric} metric and compare the visible entities or periods.\n\nLook for an outlier against peers or an earlier baseline.","reasoning":"An overall health average can hide one saturated or imbalanced entity. A peer or period comparison shows whether the pattern is exceptional.","evidence":"The ${var.metric} chart now shows the outlier, ${truth.finding}. Treat it as a hypothesis until another event corroborates its timing."},"requires":["scope"],"accepts":[{"action":["infrastructure_entity_selected","infrastructure_entities_grouped","metric_selected","metric_period_compared"],"validators":[{"kind":"result_assertion","assertion":"signal"}]}],"reference_action":{"command":"select_metric","target":"kibana.metric_selector","arguments":{"metric":"${var.metric}"}},"hints":["Compare the resource named in the brief across entities or time.","Use grouping, sorting, and the metric selector.","Select ${var.metric}; Show me can point to it."]},
    {"id":"inspect","title":"Correlate supporting evidence","concept":"Resource correlation is stronger when the timing aligns with a restart, log, or latency event.","narration":"Open supporting metric detail or correlated logs.","reasoning":"Correlation checks that the resource pattern aligns with observed impact.","evidence":"The supporting record contains the corroborating scenario fact.","demonstration":{"narration":"Open the selected entity’s metric detail or correlated logs while preserving its time context.\n\nLook for a second signal at the same entity and time.","reasoning":"A resource spike alone does not prove customer impact or causation. Matching its entity and timing to another observable signal tests the relationship.","evidence":"The supporting record should align with the outlier’s entity and time.\n\nThat independent correlation turns the metric pattern into evidence for the conclusion: ${truth.conclusion}"},"requires":["isolate"],"accepts":[{"action":["metric_period_compared","metrics_logs_opened","document_expanded","infrastructure_entity_selected"],"validators":[{"kind":"result_assertion","assertion":"corroboration"}]}],"reference_action":{"command":"navigate_from_metrics_to_logs","target":"kibana.metrics_logs_link","arguments":{}},"hints":["Check whether the timing aligns with another observable signal.","Use the entity detail or logs pivot.","Open correlated logs; Show me can demonstrate the read-only pivot."]},
    {"id":"submit","title":"Submit a metric-supported conclusion","concept":"State the entity, pattern, and time relationship without proposing an administrative repair.","narration":"Record the conclusion and supporting evidence.","reasoning":"The scenario tests Kibana interpretation, not infrastructure operation.","evidence":"The response cites the metric and correlation.","requires":["isolate","inspect"],"accepts":[{"action":"answer_submitted","validators":[{"kind":"answer_submitted"}]}],"reference_action":{"command":"request_answer","target":"coach.answer","arguments":{}},"hints":["State the resource pattern and affected entity.","Use the coach answer form.","Include finding, scope, conclusion, and evidence references."]}
  ]
}
