{"schema_version":2,"id":"schema-drift-data-quality-playbook","extends":"discover.json","variables":{"title":"Schema-drift analysis","window":"${param.window}","field":"schema.route_present","query":"schema.route_present: false","finding_phrase":"${truth.finding}"},"goal_overrides":{"isolate":{"demonstration":{"narration":"Traffic is steady, but this dashboard only counts requests with http.route. I'll search schema.route_present: false for missing routes, then check their producer and version.","reasoning":"","evidence":"The hit count now shows only requests recorded without a route. One of them should show which producer and version sent requests without http.route."},"drifts":[{"action":["filter_added","filter_changed"],"validators":[{"kind":"filter_field","field":"telemetry.producer"},{"kind":"value_not","value":"${param.incident.producer}"},{"kind":"detail_equals","field":"negate","value":false}],"note":"You filtered on the producer ${action.value}; check which producer the records missing their route come from."}]},"inspect":{"demonstration":{"narration":"I'll open one missing-route request to check its producer and version together. That shows who sent a request without http.route.","reasoning":"","evidence":"This one request has no route, and it was sent by ${param.incident.producer} on version ${param.incident.version}. ${truth.conclusion}","evidence_focus":{"kind":"document","fields":["schema.route_present","telemetry.producer","service.version"]}}}}}
