{"schema_version":2,"id":"cpu-saturation-playbook","extends":"infrastructure.json","variables":{"title":"CPU-saturation investigation","inventory":"hosts","metric":"CPU usage","entity":"checkout-03"},"goal_overrides":{"inspect":{"demonstration":{"narration":"I'll open the host's detail and logs at the CPU peak to see whether the slowdown happened at the same time.","reasoning":"A resource spike alone does not prove customer impact or causation. Matching its entity and timing to another observable signal tests the relationship.","evidence":"The supporting record should align with the outlier’s entity and time.\n\nThat independent correlation turns the metric pattern into evidence for the conclusion: ${truth.conclusion}"}}}}
