{
  "schema_version":2,"id":"apm-template","version":1,"starting_view":{"app":"apm"},
  "demonstration_summary": {"title":"${var.title} complete","checks":[{"title":"Service context","detail":"Selected the ${var.service} service in APM."},{"title":"Transaction group","detail":"Narrowed to the affected transaction group."},{"title":"Trace path","detail":"Followed one representative trace through the request."},{"title":"Decisive detail","detail":"Inspected the ${var.inspect_label} that explains ${truth.finding}."}],"answer":{"finding":"${truth.finding}","scope":"${truth.scope}","conclusion":"${truth.conclusion}","evidence_refs":"signal,corroboration","evidence":"The representative APM trace connects ${truth.finding} to ${truth.scope}."}},
  "goals":[
    {"id":"scope","title":"Select the affected service context","concept":"APM service and environment filters define the RED metrics and samples being compared.","narration":"Open the affected service in the run environment.","reasoning":"Service context prevents unrelated traces from entering the comparison.","evidence":"The service page shows scenario transactions.","demonstration":{"narration":"I'll open ${var.service} in APM to see the latency and failures for the service in this report.","reasoning":"The APM inventory combines many services. Selecting ${var.service} prevents unrelated traces from entering the comparison and gives us the correct service context.","evidence":"The service page now shows transactions for ${var.service}. This establishes where to investigate; the transaction and trace details still need inspection."},"requires":[],"accepts":[{"action":["apm_service_selected"],"validators":[{"kind":"result_assertion","assertion":"signal"}]}],"reference_action":{"command":"select_apm_service","target":"kibana.apm_service","arguments":{"service":"${var.service}"}},"hints":["Start from the service involved in the reported request.","Use the APM Services inventory.","Select ${var.service}; Show me can navigate there."]},
    {"id":"group","title":"Open the affected transaction group","concept":"Transaction groups aggregate requests with the same operation so their latency and failure distribution can be compared.","narration":"Open the affected transaction group.","reasoning":"The group connects the service-level symptom to representative request samples.","evidence":"The transaction detail view shows samples for the affected operation.","demonstration":{"narration":"I'll open the affected transaction group to find which operation's requests are slow or failing.","reasoning":"Service-wide metrics combine different operations. The transaction group narrows the question to comparable requests.","evidence":"The transaction detail view now shows the distribution and request samples for the selected operation. Choose a sample to trace the behavior end to end."},"requires":["scope"],"accepts":[{"action":"transaction_group_opened","validators":[{"kind":"result_assertion","assertion":"signal"}]}],"reference_action":{"command":"open_transaction_group","target":"kibana.transaction_group","arguments":{}},"hints":["Use the transaction table on the service overview.","Open the operation with the scenario latency or failures.","Select the affected transaction group; Show me can open it."]},
    {"id":"isolate","title":"Open a representative trace","concept":"A trace reconstructs one end-to-end request across transactions and spans.","narration":"Open a representative trace sample.","reasoning":"The trace makes timing and propagation relationships explicit.","evidence":"The representative trace contains the scenario signal.","demonstration":{"narration":"I'll open one trace from that group to see where the delay or error starts along a single request.","reasoning":"Aggregated percentiles and error rates cannot show where time was spent or how failure propagated. A trace shows each operation in order.","evidence":"The trace waterfall now shows the request path and its timing or error markers. Inspect the decisive detail before attributing the cause."},"requires":["group"],"accepts":[{"action":["trace_sample_selected","trace_opened"],"validators":[{"kind":"result_assertion","assertion":"signal"}]}],"reference_action":{"command":"select_trace_sample","target":"kibana.trace_sample","arguments":{}},"hints":["Move from the transaction group to one request.","Use the trace samples table.","Choose a representative sample; Show me can demonstrate it."]},
    {"id":"inspect","title":"Inspect the decisive trace detail","concept":"Span, error, dependency, and correlated-log details explain where the symptom originated.","narration":"Inspect the relevant trace element and its context.","reasoning":"The decisive detail distinguishes origin from upstream impact.","evidence":"The selected detail corroborates the finding.","demonstration":{"narration":"I'll inspect ${var.inspect_label} to see what happened there and whether it explains the reported request problem.","reasoning":"A slow or failed upstream transaction can be impact rather than origin. The detail helps separate the originating operation from downstream symptoms.","evidence":"The selected detail should corroborate the trace-level signal and explain why ${truth.finding} occurred.\n\nTogether, the topology and detail support the conclusion: ${truth.conclusion}"},"requires":["isolate"],"accepts":[{"action":["span_selected","error_details_opened","correlated_logs_opened","trace_opened"],"validators":[{"kind":"result_assertion","assertion":"corroboration"}]}],"reference_action":{"command":"${var.inspect_command}","target":"${var.inspect_target}","arguments":{}},"hints":["Follow the slow or failed path to its deepest decisive element.","Inspect a span, error marker, or correlated log.","Use ${var.inspect_label}; Show me can open it."]},
    {"id":"submit","title":"Submit a trace-supported conclusion","concept":"Separate the originating operation from the services where its impact becomes visible.","narration":"Record the finding, scope, and trace evidence.","reasoning":"A trace-backed conclusion should identify both cause and propagation.","evidence":"The answer cites the representative path and detail.","requires":["isolate","inspect"],"accepts":[{"action":"answer_submitted","validators":[{"kind":"answer_submitted"}]}],"reference_action":{"command":"request_answer","target":"coach.answer","arguments":{}},"hints":["State where the issue starts and how it affects the request.","Use the coach answer form.","Include finding, scope, conclusion, and evidence references."]}
  ]
}
