{"schema_version":2,"id":"slow-payments-playbook","extends":"discover.json","variables":{"title":"Slow checkout investigation","window":"10m","field":"event.duration","query":"scenario.id: \"${run_id}\" and event.duration >= 2000000000","finding_phrase":"${truth.finding}"},"goal_overrides":{"isolate":{"demonstration":{"narration":"Checkout is reported slow. I'll keep this run's requests lasting at least two seconds so we can follow the slow path without unrelated fast traffic.","reasoning":"The current window contains normal and background events. Filtering on ${var.field} reduces that noise so we can inspect the relevant records.","evidence":"The result table now shows records matching the query. Read the ${var.field} values and neighbouring fields to identify the pattern; a single record will provide a further check."},"accepts":[{"action":["query_submitted"],"validators":[{"kind":"query_contains","fields":["event.duration"],"value":">"},{"kind":"result_assertion","assertion":"signal"}]}]},"inspect":{"demonstration":{"narration":"I'll open one slow request and read its service, operation, duration, and trace ID together to see where the delay starts.","reasoning":"A total can look convincing even when it includes an unrelated record. Opening a typical event checks the key values together, rather than relying on a count alone.","evidence":"The opened event connects ${truth.finding} with ${truth.scope}. Together, this record and the filtered results support the conclusion: ${truth.conclusion}"}}}}
