{
  "schema_version":2,"id":"alerts-template","version":1,"starting_view":{"app":"alerts"},
  "demonstration_summary": {"title":"Alert triage complete","checks":[{"title":"Alert identity","detail":"Opened the alert and checked it was still active."},{"title":"Rule reason","detail":"Read the alert's reason to see what fired it."},{"title":"Source evidence","detail":"Followed the alert to its source evidence to confirm ${truth.finding}."}],"answer":{"finding":"${truth.finding}","scope":"${truth.scope}","conclusion":"${truth.conclusion}","evidence_refs":"signal,corroboration","evidence":"The alert and matching source event justify classifying it as ${truth.finding} with ${truth.scope}."}},
  "goals":[
    {"id":"scope","title":"Open the run alert","concept":"Alert status is meaningful only with its rule reason and execution time.","narration":"Find and open the controller-provisioned alert.","reasoning":"The run-scoped rule avoids unrelated alert history.","evidence":"The alert detail belongs to this run.","demonstration":{"narration":"I'll open this run's alert so we can check the rule that actually fired before judging its impact.","reasoning":"The Alerts table can contain executions from different rules and times. Opening this run’s row prevents unrelated history from influencing the decision.","evidence":"The detail view should identify this run’s alert and show its current state and execution time.\n\nThat confirms we have the correct alert, but status alone does not yet prove customer impact."},"requires":[],"accepts":[{"action":["alert_opened","alerts_filtered"],"validators":[{"kind":"result_assertion","assertion":"signal"}]}],"reference_action":{"command":"open_alert","target":"kibana.alert_row","arguments":{}},"hints":["Start with the alert created for this exercise.","Use the Alerts table and time context.","Open the active row; Show me can demonstrate it."]},
    {"id":"isolate","title":"Interpret status and reason","concept":"Status says whether the condition is active; reason explains what crossed the condition.","narration":"Inspect the alert reason and execution history.","reasoning":"A fired rule is not automatically a current customer incident.","evidence":"The reason and timing establish the alert condition.","demonstration":{"narration":"I'll read the alert's status and Reason to see whether it's still active and what crossed the rule's threshold.","reasoning":"A rule may have fired earlier, recovered, or matched harmless data. Read its current status and reason before deciding what the alert means.","evidence":"The reason and execution time should establish the scenario signal behind the alert.\n\nWe now know why it fired, but we still need a source event outside the alert document to corroborate impact."},"requires":["scope"],"accepts":[{"action":["alert_reason_inspected","alert_history_inspected"],"validators":[{"kind":"result_assertion","assertion":"signal"}]}],"reference_action":{"command":"inspect_alert_reason","target":"kibana.alert_reason","arguments":{}},"hints":["Separate the rule state from its interpretation.","Inspect Reason and the most recent execution.","Open the alert reason; Show me can point it out."]},
    {"id":"inspect","title":"Pivot to source evidence","concept":"Triage requires a source event, trace, or metric beyond the alert itself.","narration":"Follow the alert to matching source evidence.","reasoning":"The pivot verifies whether the condition represents customer impact.","evidence":"The source result corroborates the triage decision.","demonstration":{"narration":"I'll follow the source link to check whether a real event supports the alert's claim of customer impact.","reasoning":"An alert is a derived signal. Checking its source tests the condition against underlying evidence rather than the alert title alone.","evidence":"The matching source result should corroborate the condition described by the alert.\n\nAlert context plus source evidence supports the triage decision: ${truth.conclusion}"},"requires":["isolate"],"accepts":[{"action":["alert_source_opened","document_expanded","trace_opened"],"validators":[{"kind":"result_assertion","assertion":"corroboration"}]}],"reference_action":{"command":"navigate_from_alert_to_source","target":"kibana.alert_source_link","arguments":{}},"hints":["Do not classify the alert from its title alone.","Use the source link or preserve its query and time context.","Open source evidence; Show me can demonstrate the pivot."]},
    {"id":"submit","title":"Submit the triage decision","concept":"Classify state and priority, then cite the evidence that justifies the choice.","narration":"Record the triage decision.","reasoning":"A justified priority connects alert context to customer impact.","evidence":"The response cites alert and source evidence.","requires":["isolate","inspect"],"accepts":[{"action":"answer_submitted","validators":[{"kind":"answer_submitted"}]}],"reference_action":{"command":"request_answer","target":"coach.answer","arguments":{}},"hints":["Choose active, resolved, or noise and set priority.","Use the coach triage form.","Include the source evidence and reasoning."]}
  ]
}
