{
  "schema_version":2,"id":"extension-template","version":1,"starting_view":{"app":"${var.app}"},
  "demonstration_summary":{"title":"${var.title} complete","summary":"The walkthrough scoped the extension view, selected the decisive entity, and opened supporting source evidence.","checks":[{"title":"Context","detail":"The relevant time and entity scope were selected."},{"title":"Signal","detail":"The decisive extension result was inspected."},{"title":"Evidence","detail":"Source evidence corroborated the conclusion."}],"evidence":"The selected result and source record support the conclusion.","conclusion":"${truth.conclusion}","answer":{"finding":"${truth.finding}","scope":"${truth.scope}","conclusion":"${truth.conclusion}","evidence_refs":"signal,corroboration","evidence":"The extension view and source evidence support this conclusion."}},
  "goals":[
    {"id":"scope","title":"Open the relevant analysis view","concept":"Begin from the supplied read-only application and time context.","narration":"Open and scope the supplied view.","reasoning":"The correct application context is required before interpreting results.","evidence":"The scenario data is visible.","requires":[],"accepts":[{"action":["app_navigated","time_range_changed"],"validators":[{"kind":"result_assertion","assertion":"signal"}]}],"reference_action":{"command":"navigate_to_app","target":"kibana.app_navigation","arguments":{"app":"${var.app}"}},"hints":["Start in the application named by the brief.","Use Kibana navigation and the global time picker.","Open ${var.app}; Show me can navigate there."]},
    {"id":"isolate","title":"Select the decisive result","concept":"Entity selection narrows the analysis to the abnormal region, step, or anomaly.","narration":"Select the decisive result in the supplied view.","reasoning":"The selected result defines the affected scope.","evidence":"The result contains the scenario signal.","requires":["scope"],"accepts":[{"action":"${var.observation}","validators":[{"kind":"result_assertion","assertion":"signal"}]}],"reference_action":{"command":"${var.command}","target":"${var.target}","arguments":{}},"hints":["Compare the available entities for an outlier.","Select the relevant result in the read-only view.","Show me can select the decisive result."]},
    {"id":"inspect","title":"Open supporting evidence","concept":"Corroborating source evidence turns a visual result into a defensible conclusion.","narration":"Open the result detail or source records.","reasoning":"The detail verifies the cause and scope.","evidence":"A supporting record corroborates the result.","requires":["isolate"],"accepts":[{"action":["document_expanded","panel_drilldown_opened","correlated_logs_opened","field_inspected"],"validators":[{"kind":"result_assertion","assertion":"corroboration"}]}],"reference_action":{"command":"expand_document","target":"kibana.first_result","arguments":{}},"hints":["Look beyond the aggregate result.","Open its details or source records.","Show me can open supporting evidence."]},
    {"id":"submit","title":"Submit a supported conclusion","concept":"State the finding, affected scope, and evidence.","narration":"Record the conclusion.","reasoning":"The answer should connect the selected result to source evidence.","evidence":"The response cites both signals.","requires":["isolate","inspect"],"accepts":[{"action":"answer_submitted","validators":[{"kind":"answer_submitted"}]}],"reference_action":{"command":"request_answer","target":"coach.answer","arguments":{}},"hints":["Summarize the decisive result.","Use the coach answer form.","Include finding, scope, conclusion, and evidence."]}
  ]
}
