{
  "schema_version":2,"id":"slo-template","version":1,"starting_view":{"app":"slos"},
  "demonstration_summary":{"title":"SLO burn assessment complete","summary":"The walkthrough inspected the supplied SLO objective, error budget, burn rate, and supporting period.","checks":[{"title":"Objective","detail":"The target and rolling window were identified."},{"title":"Budget","detail":"Remaining error budget was interpreted."},{"title":"Burn","detail":"The period driving accelerated consumption was inspected."}],"evidence":"The SLO details and supporting signal establish the burn risk.","conclusion":"${truth.conclusion}","answer":{"finding":"${truth.finding}","scope":"${truth.scope}","conclusion":"${truth.conclusion}","evidence_refs":"signal,corroboration","evidence":"The objective, budget, and burn-rate evidence support the urgency."}},
  "goals":[
    {"id":"scope","title":"Open the supplied SLO","concept":"An SLO combines an indicator, target, and time window.","narration":"Open the controller-provisioned SLO and inspect its indicator.","reasoning":"The objective and window define what good performance means.","evidence":"The SLO detail belongs to this run.","requires":[],"accepts":[{"action":["slo_opened","slo_indicator_inspected"],"validators":[{"kind":"result_assertion","assertion":"signal"}]}],"reference_action":{"command":"open_slo","target":"kibana.slo_row","arguments":{}},"hints":["Start with the supplied service objective.","Use the SLO overview and open its detail.","Open the run SLO; Show me can demonstrate it."]},
    {"id":"isolate","title":"Interpret the error budget","concept":"Remaining budget describes tolerance left, not the current rate of consumption.","narration":"Inspect objective, window, and remaining error budget.","reasoning":"A service may still meet its objective while becoming urgent.","evidence":"The budget state is visible for the rolling window.","requires":["scope"],"accepts":[{"action":["slo_indicator_inspected","slo_error_budget_inspected"],"validators":[{"kind":"result_assertion","assertion":"signal"}]}],"reference_action":{"command":"inspect_slo_error_budget","target":"kibana.slo_error_budget","arguments":{}},"hints":["Distinguish the monthly objective from budget remaining.","Inspect the error-budget section.","Open error budget details; Show me can point them out."]},
    {"id":"inspect","title":"Inspect burn-rate evidence","concept":"Burn rate indicates how quickly the remaining tolerance is being consumed.","narration":"Inspect burn rate and its driving period.","reasoning":"Accelerated burn determines urgency before the objective is breached.","evidence":"The short period contains the corroborating failures.","requires":["isolate"],"accepts":[{"action":["slo_burn_rate_inspected","panel_underlying_data_opened","document_expanded"],"validators":[{"kind":"result_assertion","assertion":"corroboration"}]}],"reference_action":{"command":"inspect_slo_burn_rate","target":"kibana.slo_burn_rate","arguments":{}},"hints":["Now examine the speed of budget consumption.","Use the burn-rate panel and supporting period.","Inspect burn rate; Show me can demonstrate it."]},
    {"id":"submit","title":"Submit the urgency assessment","concept":"Explain current compliance, burn risk, and the indicator period driving urgency.","narration":"Record the SLO triage decision.","reasoning":"Objective status alone is insufficient when burn is accelerating.","evidence":"The answer cites objective, budget, and burn evidence.","requires":["isolate","inspect"],"accepts":[{"action":"answer_submitted","validators":[{"kind":"answer_submitted"}]}],"reference_action":{"command":"request_answer","target":"coach.answer","arguments":{}},"hints":["State both current objective status and future risk.","Use the coach triage form.","Include the driving period and indicator evidence."]}
  ]
}
