{
  "schema_version":2,"id":"discover-template","version":1,"starting_view":{"app":"discover","saved_object":"incident-investigation"},
  "demonstration_summary": {"title":"${var.title} complete","checks":[{"title":"Scope","detail":"Set the time window to catch the incident."},{"title":"Signal","detail":"Filtered with KQL to isolate ${var.finding_phrase}."},{"title":"Evidence","detail":"Opened one matching event to confirm it was real."}],"answer":{"finding":"${truth.finding}","scope":"${truth.scope}","conclusion":"${truth.conclusion}","evidence":"The KQL result and expanded event connect ${var.finding_phrase} to ${truth.scope}."}},
  "goals":[
    {"id":"scope","title":"Set the time window","concept":"Setting a time range separates the incident from everyday, background activity.","narration":"The report says the problem was first noticed ${detected_offset_minutes} minutes ago. Set a time window that reaches back to that moment without pulling in much older traffic.","reasoning":"A tight time range keeps the incident in view without letting older, unrelated data throw off the comparison.","evidence":"The histogram and results should refresh to the window you picked.","demonstration":{"narration":"The report was noticed ${detected_offset_minutes} minutes ago. I'll use the last ${var.window_spelled}, rounded to a five-minute boundary, so that moment stays in view without older traffic.","reasoning":"","evidence":"The histogram and hit count now cover only the last ${var.window_spelled}. The report from ${detected_offset_minutes} minutes ago sits inside that window, and older traffic is left out of the comparison."},"requires":[],"accepts":[{"action":"time_range_changed","validators":[{"kind":"time_range_contains","any_valid":true}]},{"action":"auto_refresh_changed","validators":[{"kind":"always"}]}],"drifts":[{"action":["query_submitted","filter_added"],"validators":[],"note":"You started searching before setting the time window; this step is about choosing when to look."}],"reference_action":{"command":"set_time_range","target":"kibana.time_picker","arguments":{"from":"now-${var.window}","to":"now"}},"hints":["Too short a window misses the report entirely; a much longer one mixes older, normal traffic into the comparison.","Use the date picker at the top of Discover (or click and drag on the date histogram); choose a short range that still reaches the reported time. For a live view you can also turn on auto-refresh.","Set the range to the last ${var.window_spelled}; Show me can do it for you."]},
    {"id":"isolate","title":"Isolate the decisive records","concept":"A query should narrow the evidence without assuming more than the brief establishes.","narration":"Narrow the results to the records behind the report: filter or query the field that separates them from normal traffic.","reasoning":"Filtering the decisive field makes the abnormal group comparable with normal records.","evidence":"The remaining result set contains the scenario signal.","demonstration":{"narration":"I'll filter on ${var.field} to focus on records tied to the reported symptom, then see which values remain.","reasoning":"The current window contains normal and background events. Filtering on ${var.field} reduces that noise so we can inspect the relevant records.","evidence":"The query bar now holds the filter, and the hit count shows how many records match it. Those remaining records are the ones to examine; opening one of them comes next."},"requires":["scope"],"accepts":[{"action":["query_submitted","filter_added","filter_changed"],"validators":[{"kind":"query_contains","fields":["${var.field}"],"value_from_truth":"answers.finding"},{"kind":"result_assertion","assertion":"signal"}]},{"action":["filter_added","filter_changed"],"validators":[{"kind":"filter_contains","field":"${var.field}","value_from_truth":"answers.finding"},{"kind":"result_assertion","assertion":"signal"}]}],"reference_action":{"command":"enter_kql","target":"kibana.query_bar","arguments":"${var.query}"},"hints":["Identify the field that separates the abnormal records.","Use the KQL bar — combine clauses with and/or/not and parentheses, match with * wildcards or test a field with field:* — or Add filter (field, operator, value) and filter for or out (is not) a value from a row or a field's top values.","Filter on ${var.field}; Show me can enter a reference query."]},
    {"id":"inspect","title":"Check the evidence in one event","concept":"A conclusion is stronger when you open one typical event and check it.","narration":"Open one typical result and read the fields that back up the finding.","reasoning":"Checking a single event stops you from drawing a conclusion from totals alone.","evidence":"The event you open contains the facts that back up the finding.","demonstration":{"narration":"I'll open one matching event to check the key fields together. A result count alone can't show whether they occur in the same request.","reasoning":"A total can look convincing even when it includes an unrelated record. Opening a typical event checks the key values together, rather than relying on a count alone.","evidence":"This one event shows ${truth.finding} together with ${truth.scope}, not just in a total. That supports the conclusion: ${truth.conclusion}"},"requires":["isolate"],"accepts":[{"action":["document_expanded","trace_opened","surrounding_documents_opened","column_added"],"validators":[{"kind":"result_assertion","assertion":"corroboration"}]}],"reference_action":{"command":"expand_document","target":"kibana.first_result","arguments":{}},"hints":["Check one typical record instead of relying only on the count.","Expand a row to read all of its fields, or add the key field as a column to compare it across rows.","Open the first result; Show me can do it for you."]},
    {"id":"submit","title":"Submit a conclusion you can back up","concept":"A good answer states the finding, its scope, and the evidence that links them.","narration":"Write down the conclusion and point to the evidence for it.","reasoning":"The answer should keep what you saw separate from what you worked out.","evidence":"The answer points to the signal and the event that backs it up.","requires":["isolate","inspect"],"accepts":[{"action":"answer_submitted","validators":[{"kind":"answer_submitted"}]}],"reference_action":{"command":"request_answer","target":"coach.answer","arguments":{}},"hints":["Sum up what the evidence shows.","Use the coach's answer form: name what you found, its scope, and what the evidence shows.","Submit the finding, scope and conclusion; Show me shows the reference summary."]}
  ]
}
